<?xml version="1.0" encoding="UTF-8"?>
<?xml-stylesheet type="text/xsl" href="bibliotheque.xsl" ?>
<!-- <!DOCTYPE bibliotheque SYSTEM "bibliotheque.dtd"> -->
<!--<bibliotheque xmlns:xs="http://www.w3.org/2001/XMLSchema-instance" xs:noNamespaceSchemaLocation="bibliotheque.xsd"> -->
<bibliotheque>
    <livres>
        
        
    <livre num="1"><titre>titre</titre><auteur><nom>SOUKAINA BENZARIYA</nom><email>benzariyasaida@gmail.com</email></auteur><categorie>22</categorie><datePublication>ww</datePublication><resume>fff</resume><editeur><nom>ww</nom><adresse><rue>ss</rue><ville>ss</ville><pays>Maroc</pays></adresse></editeur></livre></livres>
    
  
</bibliotheque>
